"Category";"Aspect";"CurrentSituation";"Phase1";"Phase2";"Phase3"
"Receiving & QC";"Delivery Verification";"Invoices and item details are checked manually, including expiration dates. Limited digital tools.";"- Introduce barcode/QR scanning\n- Centralize record-keeping in one spreadsheet/db\n- Train Finance Director for automated PO approvals\n- Upskill one in-house programmer with Python";"- Integrate real-time cross-referencing tool for deliveries vs. POs\n- Create dashboards/alerts for mismatches";"- Implement predictive algorithms to flag high-risk deliveries\n- Use ML for forecasting shortages or delays"
"Receiving & QC";"Quality Control (QC)";"Items inspected visually for damages and shelf-life. Near half-life items are rejected without data-based tracking.";"- Record QC checks digitally (tablets/mobile)\n- Basic color-coded alerts for near-expiry\n- Finance Director learns basic automated checks\n- In-house Python scripts for QC reporting";"- Employ sensors/image recognition for automatic damage detection\n- Link QC data to inventory records for auto-removal";"- AI-driven QC with predictive maintenance\n- Integrate computer vision for advanced anomaly detection"
"Inventory Management";"Stock Entry";"Manual entry for new items, scanning only for existing ones. High risk of errors.";"- Standardize barcode formats\n- Single system (spreadsheet or db) for all entries\n- Finance Director approves POs quickly\n- Python scripts automate batch uploads";"- Sync with supplier databases in real time\n- Simple data verification layer flags conflicts";"- Predictive demand planning for stock entry\n- Automated reorder suggestions (seasonality, promotions, history)"
"Inventory Management";"Storage & Categorization";"Items categorized manually, stored by broad product type, not optimized for quick retrieval.";"- Assign digital shelf IDs\n- Basic category list for consistent grouping\n- Python helps build simple categorization scripts";"- AI or rule-based system suggests optimal shelf placement based on demand frequency\n- Barcode scanning tracks item movement";"- Robotics or AI picking/packing\n- Continuous shelf optimization (learning from picking patterns)"
"Inventory Management";"Stock Allocation";"Manually tracked allocation to selling floor. Discrepancies between recorded vs. actual stock.";"- Digital movement log/app to track each product leaving the stockroom\n- Daily/weekly reconciliation";"- Real-time tracking sensors (RFID) for automatic updates\n- Dashboards highlight allocation discrepancies";"- AI predicts replenishment needs per shelf\n- Automated orders to maintain optimal floor stock"
"Store-Level Operations";"Receiving Stock at Stores";"Items moved manually from stockroom to sales floor, no automated updates.";"- Scan items to 'moved' or 'available' status\n- Single shared db tracks location\n- Finance Director sees large inbound shipments data";"- Real-time scanning or RFID to monitor movement\n- Notifications for urgent restock items";"- Advanced analytics on item-flow patterns\n- Automated dispatch signals for shelves nearing low stock"
"Store-Level Operations";"Shelf Stocking";"Shelves arranged mostly by category, but related items can be scattered.";"- Create a simple classification scheme (brand/usage)\n- Basic digital shelf map or planogram\n- Capture sales data for future improvement";"- AI-based product placement (based on sales)\n- Auto-updating planograms as products change";"- Real-time planogram optimization\n- Shopper behavior heatmaps for granular product placement"
"Store-Level Operations";"Pricing & Promotions";"Prices and promotions set by clerks' experience, often inconsistent.";"- Centralize pricing in one system\n- Finance Director training for price approvals\n- Python scripts for bulk pricing updates";"- Rule-based engine auto-applies discounts under conditions (stock age, inventory levels)\n- Analytics dashboard to measure promo impact";"- AI-driven dynamic pricing in real time\n- Personalized offers based on purchase history"
"Selling the Items";"Customer Interaction";"~50,000 items, arrangement not aligned with demand or turnover efficiency.";"- Track basic foot traffic or busy aisles\n- Log top sellers by location in a spreadsheet";"- Implement AI to identify high-traffic areas\n- Digital signage/app notifications for cross-selling";"- AR navigation or advanced store apps\n- Real-time staff deployment based on foot traffic data"
"Selling the Items";"Checkout Process";"Barcodes used, but shared codes cause confusion. Daily reconciliations do not fully fix errors.";"- Standardize barcode assignment (unique codes)\n- POS software flags duplicate barcodes";"- Advanced POS with image or weight checks\n- Real-time inventory sync at checkout";"- Cashierless or AI-based recognition\n- Continuous engine refining mislabeled items"
"Post-Sale & Procurement";"Customer Feedback";"Informal feedback, no structured analysis. Hard to gather insights or improve.";"- Encourage basic digital feedback forms\n- Central place to log suggestions/complaints";"- Data analytics on collected feedback\n- Trend analysis for service improvement";"- Predictive modeling for customer preferences\n- Personalized recommendations or loyalty programs"
"Post-Sale & Procurement";"Reordering";"Reorders depend on manual checks and periodic system suggestions, not real-time analytics.";"- Basic scanning for low-stock items\n- Finance Director approvals via a shared system\n- Python scripts to highlight reorder thresholds";"- Automated reordering suggestions via real-time sales & inventory data\n- Supplier integration for immediate restock";"- Fully AI-driven reorder triggers (forecast-based)\n- Dynamic quantity adjustments factoring seasonality, promotions"
"Post-Sale & Procurement";"Returns & Refunds";"Manual refunds require supervisor intervention, paper-based process.";"- Simple digital form for returns (spreadsheet or basic tool)\n- Basic rules for refund approvals";"- Automated system with predefined approval rules\n- Real-time updates to inventory upon refund";"- Advanced data checks for fraudulent returns\n- AI-based anomaly detection in refund patterns"
"Post-Sale & Procurement";"Purchase Orders (POs)";"POs based on weekly/monthly sales data. Supplier errors due to duplicate/incorrect barcodes.";"- Short finance director training for automated PO sign-off\n- Basic scanning to match barcodes vs. supplier docs";"- Dynamic POs from real-time sales & stock analytics\n- Enhanced barcode validation to minimize supplier errors";"- ML-based supply chain optimization\n- Automatic feedback loops for barcode inaccuracies"
